{
  "$schema": "../schemas/controller-release.v3.schema.json",
  "schemaVersion": 3,
  "controllerId": "agentic-delivery",
  "version": "0.2.0-draft.67",
  "commit": "98495275481aff381180771da6eba9da95bc7816",
  "bootstrapCommit": "cd17de4e93b7ecbdbe3a1bbe80a720b18f360978",
  "contracts": {
    "eventEnvelope": 1,
    "lifecycle": "1.0.0",
    "stateMachine": "1.0.0",
    "evidence": "1.0.0"
  },
  "support": {
    "eventEnvelopeVersions": [
      1
    ],
    "lifecycleVersions": [
      "1.0.0"
    ],
    "stateMachineVersions": [
      "1.0.0"
    ],
    "evidenceVersions": [
      "1.0.0"
    ],
    "primitiveCompatibility": [
      "0.x"
    ],
    "architectureCompatibility": [
      "0.x"
    ],
    "minimumBootstrapVersion": "0.2.0-draft.67",
    "policy": {
      "supportWindowDays": 90,
      "majorStrategy": "current-and-immediately-previous",
      "preReleaseException": "no-previous-ga-major",
      "securityRevocation": "fail-closed-with-incident"
    },
    "githubAppContractVersions": [
      "2.0.0"
    ]
  },
  "dependencies": {
    "architecture": {
      "repository": "agentic-delivery-lab/agentic-delivery-architecture",
      "repositoryId": 1380894616,
      "version": "0.1.0-draft.78",
      "commit": "59df514a3a6dc8a75b79b3fc75fe61aae4e6fdf3",
      "contentSha256": "02f150dfd46b8c304f61196ff65d7f8a05adc0cc151402573b10803491ac4550"
    },
    "primitives": {
      "repository": "agentic-delivery-lab/agentic-delivery-agent-customizations",
      "repositoryId": 1380894656,
      "version": "0.1.0-draft.15",
      "commit": "69beab027d8b28fc082fa6054f4def5ba0146e3c",
      "contentSha256": "4b6c07deb6f7be8f495244e3c50a528054528db1fdec5a5a14ea4cfdda5bb34e"
    }
  },
  "compatibility": {
    "eventEnvelope": 1,
    "lifecycle": "1.0.0",
    "stateMachine": "1.0.0",
    "evidence": "1.0.0",
    "controllers": [
      {
        "version": "0.2.0-draft.67",
        "commit": "98495275481aff381180771da6eba9da95bc7816",
        "contracts": {
          "eventEnvelope": 1,
          "lifecycle": "1.0.0",
          "stateMachine": "1.0.0",
          "evidence": "1.0.0"
        },
        "dependencies": {
          "architecture": {
            "repository": "agentic-delivery-lab/agentic-delivery-architecture",
            "repositoryId": 1380894616,
            "version": "0.1.0-draft.78",
            "commit": "59df514a3a6dc8a75b79b3fc75fe61aae4e6fdf3",
            "contentSha256": "02f150dfd46b8c304f61196ff65d7f8a05adc0cc151402573b10803491ac4550"
          },
          "primitives": {
            "repository": "agentic-delivery-lab/agentic-delivery-agent-customizations",
            "repositoryId": 1380894656,
            "version": "0.1.0-draft.15",
            "commit": "69beab027d8b28fc082fa6054f4def5ba0146e3c",
            "contentSha256": "4b6c07deb6f7be8f495244e3c50a528054528db1fdec5a5a14ea4cfdda5bb34e"
          }
        }
      },
      {
        "version": "0.2.0-draft.66",
        "commit": "08728c4210ec2d227eec2b6c182dcf3bafd80db1",
        "contracts": {
          "eventEnvelope": 1,
          "lifecycle": "1.0.0",
          "stateMachine": "1.0.0",
          "evidence": "1.0.0"
        },
        "dependencies": {
          "architecture": {
            "repository": "agentic-delivery-lab/agentic-delivery-architecture",
            "version": "0.1.0-draft.18",
            "commit": "7db77a53841d6a1e451e0a536fe68416e050b0de",
            "contentSha256": "5352c13fd6c3da425f427c8ac3ddc3deb9c52bdbac2837563ac580b4da4b71fb"
          },
          "primitives": {
            "repository": "agentic-delivery-lab/agentic-delivery-primitives",
            "version": "0.1.0-draft.4",
            "commit": "01dc8df9eae5ee8394d05246dbf9ccdcddaa7c9e",
            "contentSha256": "36a7e7e95a89ee00288f08a30ac41e4166e11516165e93af47b342026ce894d0"
          }
        }
      },
      {
        "version": "0.2.0-draft.65",
        "commit": "103bea69b2f9a94bad6bdaa648df98635c193a5c",
        "contracts": {
          "eventEnvelope": 1,
          "lifecycle": "1.0.0",
          "stateMachine": "1.0.0",
          "evidence": "1.0.0"
        },
        "dependencies": {
          "architecture": {
            "repository": "agentic-delivery-lab/agentic-delivery-architecture",
            "version": "0.1.0-draft.18",
            "commit": "7db77a53841d6a1e451e0a536fe68416e050b0de",
            "contentSha256": "5352c13fd6c3da425f427c8ac3ddc3deb9c52bdbac2837563ac580b4da4b71fb"
          },
          "primitives": {
            "repository": "agentic-delivery-lab/agentic-delivery-primitives",
            "version": "0.1.0-draft.4",
            "commit": "01dc8df9eae5ee8394d05246dbf9ccdcddaa7c9e",
            "contentSha256": "36a7e7e95a89ee00288f08a30ac41e4166e11516165e93af47b342026ce894d0"
          }
        }
      },
      {
        "version": "0.2.0-draft.64",
        "commit": "29f9638ffcefdf50d3b6a24330b4bc6efe60b935",
        "contracts": {
          "eventEnvelope": 1,
          "lifecycle": "1.0.0",
          "stateMachine": "1.0.0",
          "evidence": "1.0.0"
        },
        "dependencies": {
          "architecture": {
            "repository": "agentic-delivery-lab/agentic-delivery-architecture",
            "version": "0.1.0-draft.18",
            "commit": "7db77a53841d6a1e451e0a536fe68416e050b0de",
            "contentSha256": "5352c13fd6c3da425f427c8ac3ddc3deb9c52bdbac2837563ac580b4da4b71fb"
          },
          "primitives": {
            "repository": "agentic-delivery-lab/agentic-delivery-primitives",
            "version": "0.1.0-draft.4",
            "commit": "01dc8df9eae5ee8394d05246dbf9ccdcddaa7c9e",
            "contentSha256": "36a7e7e95a89ee00288f08a30ac41e4166e11516165e93af47b342026ce894d0"
          }
        }
      },
      {
        "version": "0.2.0-draft.63",
        "commit": "e840a775bc1b29867155c824e060660cf907b676",
        "contracts": {
          "eventEnvelope": 1,
          "lifecycle": "1.0.0",
          "stateMachine": "1.0.0",
          "evidence": "1.0.0"
        },
        "dependencies": {
          "architecture": {
            "repository": "agentic-delivery-lab/agentic-delivery-architecture",
            "version": "0.1.0-draft.18",
            "commit": "7db77a53841d6a1e451e0a536fe68416e050b0de",
            "contentSha256": "5352c13fd6c3da425f427c8ac3ddc3deb9c52bdbac2837563ac580b4da4b71fb"
          },
          "primitives": {
            "repository": "agentic-delivery-lab/agentic-delivery-primitives",
            "version": "0.1.0-draft.4",
            "commit": "01dc8df9eae5ee8394d05246dbf9ccdcddaa7c9e",
            "contentSha256": "36a7e7e95a89ee00288f08a30ac41e4166e11516165e93af47b342026ce894d0"
          }
        }
      },
      {
        "version": "0.2.0-draft.62",
        "commit": "0145f5394eb6cb2cb080d609bb271fd5e308c932",
        "contracts": {
          "eventEnvelope": 1,
          "lifecycle": "1.0.0",
          "stateMachine": "1.0.0",
          "evidence": "1.0.0"
        },
        "dependencies": {
          "architecture": {
            "repository": "agentic-delivery-lab/agentic-delivery-architecture",
            "version": "0.1.0-draft.18",
            "commit": "7db77a53841d6a1e451e0a536fe68416e050b0de",
            "contentSha256": "5352c13fd6c3da425f427c8ac3ddc3deb9c52bdbac2837563ac580b4da4b71fb"
          },
          "primitives": {
            "repository": "agentic-delivery-lab/agentic-delivery-primitives",
            "version": "0.1.0-draft.4",
            "commit": "01dc8df9eae5ee8394d05246dbf9ccdcddaa7c9e",
            "contentSha256": "36a7e7e95a89ee00288f08a30ac41e4166e11516165e93af47b342026ce894d0"
          }
        }
      },
      {
        "version": "0.2.0-draft.61",
        "commit": "3f7efb8f1f51ba981dc17dd4cf6a74c579df0a6e",
        "contracts": {
          "eventEnvelope": 1,
          "lifecycle": "1.0.0",
          "stateMachine": "1.0.0",
          "evidence": "1.0.0"
        },
        "dependencies": {
          "architecture": {
            "repository": "agentic-delivery-lab/agentic-delivery-architecture",
            "version": "0.1.0-draft.8",
            "commit": "9d4872c39e9c52075a7a299ad4584ac3eb704a1b",
            "contentSha256": "ac4430f7aa86c016c51ea8f9458627d4412d36256960c1bf54b63e851dc2350c"
          },
          "primitives": {
            "repository": "agentic-delivery-lab/agentic-delivery-primitives",
            "version": "0.1.0-draft.4",
            "commit": "01dc8df9eae5ee8394d05246dbf9ccdcddaa7c9e",
            "contentSha256": "36a7e7e95a89ee00288f08a30ac41e4166e11516165e93af47b342026ce894d0"
          }
        }
      },
      {
        "version": "0.2.0-draft.60",
        "commit": "d3036197be223efa2050e9d795dac87c6b8df68c",
        "contracts": {
          "eventEnvelope": 1,
          "lifecycle": "1.0.0",
          "stateMachine": "1.0.0",
          "evidence": "1.0.0"
        },
        "dependencies": {
          "architecture": {
            "repository": "agentic-delivery-lab/agentic-delivery-architecture",
            "version": "0.1.0-draft.8",
            "commit": "9d4872c39e9c52075a7a299ad4584ac3eb704a1b",
            "contentSha256": "ac4430f7aa86c016c51ea8f9458627d4412d36256960c1bf54b63e851dc2350c"
          },
          "primitives": {
            "repository": "agentic-delivery-lab/agentic-delivery-primitives",
            "version": "0.1.0-draft.4",
            "commit": "01dc8df9eae5ee8394d05246dbf9ccdcddaa7c9e",
            "contentSha256": "36a7e7e95a89ee00288f08a30ac41e4166e11516165e93af47b342026ce894d0"
          }
        }
      },
      {
        "version": "0.2.0-draft.59",
        "commit": "2ab8bbe20c2ae01616af91ee224dcb1da881ed0c",
        "contracts": {
          "eventEnvelope": 1,
          "lifecycle": "1.0.0",
          "stateMachine": "1.0.0",
          "evidence": "1.0.0"
        },
        "dependencies": {
          "architecture": {
            "repository": "agentic-delivery-lab/agentic-delivery-architecture",